주제,기사 제목,기사 URL,편향성 평가,주요 문장,비고
뉴진스,"""뉴진스, 생떼 그만 부려"" 일방적 계약 해지에 뿔난 진짜 '노동자'들",https://www.msn.com/ko-kr/news/national/%EB%89%B4%EC%A7%84%EC%8A%A4-%EC%83%9D%EB%96%BC-%EA%B7%B8%EB%A7%8C-%EB%B6%80%EB%A0%A4-%EC%9D%BC%EB%B0%A9%EC%A0%81-%EA%B3%84%EC%95%BD-%ED%95%B4%EC%A7%80%EC%97%90-%EB%BF%94%EB%82%9C-%EC%A7%84%EC%A7%9C-%EB%85%B8%EB%8F%99%EC%9E%90-%EB%93%A4/ar-AA1vmgCQ?ocid=BingNewsVerp,-3,"뉴진스는 생떼 그만 쓰라면서 비판 성명을 냈다, 뉴진스의 생떼는 더 이상 참아주기 힘들었던 것, 뉴진스는 하루빨리 생떼같은 무책임한 주장을 철회하고 초심으로 돌아가 정상적인 활동을 이어가라, 뉴진스가 당당하게 계약 해지 위약금도 내지 않고 전속계약을 마음대로 해지하면서 광고 수익 챙기고 그룹명도 가져가겠다고 발언해 분노를 불러 일으켰다, 뉴진스의 온갖 논란에 템퍼링 의혹, 구체적 증거를 제시하지 않고 일방적인 주장만으로 전속계약을 해지할 수 있다는 발상에 큰 우려를 표한다, 뉴진스의  일방적인 전속계약 해지를 통보한 것은 매우 무책임한 행동, 뉴진스의 이러한 행동은 법적 기준과 산업적 관행을 모두 무시한 것으로 강력히 비판받아 마땅하다, 뉴진스가 전속계약 만료 전 아티스트를 유인하는 템퍼링 의혹에 연루돼있어 우려스럽다, 이는 고도로 발전된 신종 템퍼링, 뉴진스의 일방적인 해지 선언은 매우 위험한 선례, 이러한 사건이 반복되면 앞으로 누가 대한민국 K팝 시장에 투자하겠나, ",
뉴진스,"""뉴진스, 생떼 그만 부려"" 일방적 계약 해지에 뿔난 진짜 '노동자'들",https://www.msn.com/ko-kr/news/national/%EB%89%B4%EC%A7%84%EC%8A%A4-%EC%83%9D%EB%96%BC-%EA%B7%B8%EB%A7%8C-%EB%B6%80%EB%A0%A4-%EC%9D%BC%EB%B0%A9%EC%A0%81-%EA%B3%84%EC%95%BD-%ED%95%B4%EC%A7%80%EC%97%90-%EB%BF%94%EB%82%9C-%EC%A7%84%EC%A7%9C-%EB%85%B8%EB%8F%99%EC%9E%90-%EB%93%A4/ar-AA1vmgCQ?ocid=BingNewsVerp,-2,"소속사와의 대화를 포함한 전향적인 태도를 보여달라, ",
뉴진스,"뉴진스 ""어도어 소송 제기 유감, 이미 투자금 초과 이익 돌려줬다""",https://www.msn.com/ko-kr/entertainment/music/%EB%89%B4%EC%A7%84%EC%8A%A4-%EC%96%B4%EB%8F%84%EC%96%B4-%EC%86%8C%EC%86%A1-%EC%A0%9C%EA%B8%B0-%EC%9C%A0%EA%B0%90-%EC%9D%B4%EB%AF%B8-%ED%88%AC%EC%9E%90%EA%B8%88-%EC%B4%88%EA%B3%BC-%EC%9D%B4%EC%9D%B5-%EB%8F%8C%EB%A0%A4%EC%A4%AC%EB%8B%A4/ar-AA1vmu8Q?ocid=BingNewsVerp,3,"이미 투자금을 초과하는 이익을 어도어와 하이브에 돌려줬다, 하이브는 저희의 가치를 하락시키기 위해 음해하고 역바이럴 하는 등 각종 방해를 시도했으며 어도어는 경영진이 바뀐 뒤 이를 방조했다, 저희를 보호해야 하는 회사에서 스스로 악플을 생산한 것이나 다름없는 일, 이러한 신뢰 관계의 파탄을 고려할 때 저희는 앞으로 더 많은 피해를 입게 될 가능성이 높다는 판단에 이르렀다, 소속 아티스트를 보호할 의무조차 제대로 이행하지 못하며 수차례 계약 사항을 위반한 어도어와 하이브에 대한 신뢰는 이미 무너졌다, 어도어와 하이브와 함께 일해야 할 이유는 더 이상 존재하지 않는다, 어도어는 이를 전혀 시정하지 못했다, 뒤에서 저희를 미행하고 음해하며 허위 사실을 유포한 매체의 기사를 접했을 때 저희는 공포와 혐오감을 느끼지 않을 수 없었다",
뉴진스,"뉴진스 ""어도어 소송 제기 유감, 이미 투자금 초과 이익 돌려줬다""",https://www.msn.com/ko-kr/entertainment/music/%EB%89%B4%EC%A7%84%EC%8A%A4-%EC%96%B4%EB%8F%84%EC%96%B4-%EC%86%8C%EC%86%A1-%EC%A0%9C%EA%B8%B0-%EC%9C%A0%EA%B0%90-%EC%9D%B4%EB%AF%B8-%ED%88%AC%EC%9E%90%EA%B8%88-%EC%B4%88%EA%B3%BC-%EC%9D%B4%EC%9D%B5-%EB%8F%8C%EB%A0%A4%EC%A4%AC%EB%8B%A4/ar-AA1vmu8Q?ocid=BingNewsVerp,2, 비인간적인 회사로 인해 피해를 입는 분들이 저희에서 끝나는게 아니라는게 괴롭다,
뉴진스,"연제협 ""뉴진스, 전속계약 해지 통보 무책임… 생떼 같은 주장 철회하라"" 지탄 [공식](전문)",https://www.msn.com/ko-kr/news/other/%EC%97%B0%EC%A0%9C%ED%98%91-%EB%89%B4%EC%A7%84%EC%8A%A4-%EC%A0%84%EC%86%8D%EA%B3%84%EC%95%BD-%ED%95%B4%EC%A7%80-%ED%86%B5%EB%B3%B4-%EB%AC%B4%EC%B1%85%EC%9E%84-%EC%83%9D%EB%96%BC-%EA%B0%99%EC%9D%80-%EC%A3%BC%EC%9E%A5-%EC%B2%A0%ED%9A%8C%ED%95%98%EB%9D%BC-%EC%A7%80%ED%83%84-%EA%B3%B5%EC%8B%9D-%EC%A0%84%EB%AC%B8/ar-AA1vlJFB?ocid=BingNewsVerp,-2,"전속계약은 단순한 계약이 아니라 상호 신뢰와 약속의 결실입니다, 뉴진스는 사유를 뒷받침할 구체적 증거를 제시하지 않았습니다, 울러 템퍼링 의혹과 같은 불법적 행위에 대해서는 철저한 진상 조사가 이루어지길 바랍니다",
뉴진스,"연제협 ""뉴진스, 전속계약 해지 통보 무책임… 생떼 같은 주장 철회하라"" 지탄 [공식](전문)",https://www.msn.com/ko-kr/news/other/%EC%97%B0%EC%A0%9C%ED%98%91-%EB%89%B4%EC%A7%84%EC%8A%A4-%EC%A0%84%EC%86%8D%EA%B3%84%EC%95%BD-%ED%95%B4%EC%A7%80-%ED%86%B5%EB%B3%B4-%EB%AC%B4%EC%B1%85%EC%9E%84-%EC%83%9D%EB%96%BC-%EA%B0%99%EC%9D%80-%EC%A3%BC%EC%9E%A5-%EC%B2%A0%ED%9A%8C%ED%95%98%EB%9D%BC-%EC%A7%80%ED%83%84-%EA%B3%B5%EC%8B%9D-%EC%A0%84%EB%AC%B8/ar-AA1vlJFB?ocid=BingNewsVerp,-3,"이는 단순한 계약 위반의 국면이 아니라, 소속사와 아티스트가 오랜 기간 함께 쌓아온 협력 관계를 배반하는 행동입니다,  이와 연관된 템퍼링 의혹은 소속사와 아티스트 간 관계를 무너뜨린다, 이러한 템퍼링은 산업 전반에 대한 신뢰도를 크게 하락시킨다, 이러한 템퍼링은 투자를 크게 위축시키는 결과를 만들고 있습니다, 뉴진스가 하루빨리 생떼같은 무책임한 주장을 철회하고",
뉴진스,"연제협 ""뉴진스, 전속계약 해지 통보 무책임… 생떼 같은 주장 철회하라"" 지탄 [공식](전문)",https://www.msn.com/ko-kr/news/other/%EC%97%B0%EC%A0%9C%ED%98%91-%EB%89%B4%EC%A7%84%EC%8A%A4-%EC%A0%84%EC%86%8D%EA%B3%84%EC%95%BD-%ED%95%B4%EC%A7%80-%ED%86%B5%EB%B3%B4-%EB%AC%B4%EC%B1%85%EC%9E%84-%EC%83%9D%EB%96%BC-%EA%B0%99%EC%9D%80-%EC%A3%BC%EC%9E%A5-%EC%B2%A0%ED%9A%8C%ED%95%98%EB%9D%BC-%EC%A7%80%ED%83%84-%EA%B3%B5%EC%8B%9D-%EC%A0%84%EB%AC%B8/ar-AA1vlJFB?ocid=BingNewsVerp,-1,"한 사람의 스타가 만들어지는 과정과 움직이는 모든 과정 속에는 그 기업에 몸담고 있는 수많은 근로자들의 격무와 희생이 뒷받침되고 있습니다, 아티스트와의 전속계약 분쟁과 템퍼링 문제는 기업의 존립과 더불어 그동안 종사하고 있던 수많은 근로자들의 생계와도 심각하게 직결되는 만큼 더 이상 아티스트의 일방적인 해지 통보와 같은 문제가 발생하지 않도록 확실한 보완책을 마련해 줄 것",
뉴진스,"뉴진스 멤버들 ""2주일내 민희진 대표 복귀 안되면 전속계약 해지""",https://www.chosun.com/culture-life/culture_general/2024/11/13/KMTCRMYVRRDAPFVJIEJ3PBGRLY/,2,"이를 받아들이지 않을 시 전속계약을 해지하겠다, 하이브는해 뉴진스의 매니지먼트사로서 필요한 모든 조치를 하라, 하니에게 무시해라고 발언한 매니저의 공식적인 사과, 음반 밀어내기로 뉴진스가 받은 피해 파악과 해결책 마련, 뉴진스는 이러한 소문과 아무런 관련이 없다",